{
  "schema": "ml-evidence/v1",
  "evidence_id": "ml-evidence-0007",
  "study_id": "synthetic-ml-study-001",
  "kind": "drift_assessment",
  "data_provenance": "public",
  "content_sha256": "0123456789abcdef0123456789abcdef0123456789abcdef0123456789abcdef",
  "seeds": [
    11,
    22,
    33
  ],
  "frozen_holdout": true,
  "summary": "Drift evaluation between the train and holdout windows.",
  "limitations": []
}
