{
  "schema": "ml-evidence/v1",
  "evidence_id": "ml-evidence-0004",
  "study_id": "synthetic-ml-study-001",
  "kind": "calibration_assessment",
  "data_provenance": "public",
  "content_sha256": "0123456789abcdef0123456789abcdef0123456789abcdef0123456789abcdef",
  "seeds": [
    11,
    22,
    33
  ],
  "frozen_holdout": true,
  "summary": "Calibration evaluation (reliability bins) on the frozen holdout.",
  "limitations": []
}
