{
  "schema": "ml-evidence/v1",
  "evidence_id": "ml-evidence-0010",
  "study_id": "synthetic-ml-study-001",
  "kind": "experiment_run",
  "data_provenance": "synthetic",
  "content_sha256": "0123456789abcdef0123456789abcdef0123456789abcdef0123456789abcdef",
  "seeds": [
    1,
    2
  ],
  "frozen_holdout": false,
  "summary": "Repeated-seed experiment on the synthetic dataset, validation-evaluated.",
  "limitations": []
}
